<?xml version='1.0' encoding='UTF-8'?>
<!DOCTYPE datashape SYSTEM "DataShape.dtd">

<!-- Copyright (C) 2010-2012, Wan Lee, wan5332@gmail.com -->
<!-- Example of creating simple records such as Customers -->
<datashape>
  <database type="POSTGRESQL">
    <connection>jdbc:postgresql://localhost:5432/actproj</connection>
  </database>
  <population-spec>
    <table-population name="CUSTOMER">
      <size>1000</size>
    </table-population>
  </population-spec>
  <tables-spec>
    <shared-sequence name="ACTPROJ"></shared-sequence>
    <table name="CUSTOMER">
      <sql-statement>INSERT INTO ACTPROJ.USR (USR_ID, EMAIL, NAME, USR_TYPE, SYS_TENANT_ID, TIMEZONE, DESCRIPTION) VALUES (?, ?, ?, ?, ?, ?, ?)</sql-statement>
      <data-type>java.math.BigDecimal, java.lang.String, java.lang.String, java.lang.String, java.math.BigDecimal, java.lang.String, java.lang.String</data-type>
      <input-data>
        <row>&apos;${ds-nextval}&apos;, &apos;customer${ds-current-record-id}@yahoo.com&apos;, &apos;Customer ${ds-current-record-id}&apos;, &apos;customer&apos;, &apos;123456&apos;, &apos;UTC-7&apos;, &apos;A loyal customer from Sunnyvale, California. ${ds-user-signature} ${ds-current-datetime}&apos;</row>
        <row>&apos;${ds-nextval}&apos;, &apos;customer${ds-current-record-id}@yahoo.com&apos;, &apos;Customer ${ds-current-record-id}&apos;, &apos;customer&apos;, &apos;123456&apos;, &apos;UTC&apos;, &apos;A loyal customer from Sunnyvale, California. ${ds-user-signature} ${ds-current-datetime}&apos;</row>
        <row>&apos;${ds-nextval}&apos;, &apos;customer${ds-current-record-id}@yahoo.com&apos;, &apos;Customer ${ds-current-record-id}&apos;, &apos;customer&apos;, &apos;123456&apos;, &apos;UTC+8&apos;, &apos;A loyal customer from Sunnyvale, California. ${ds-user-signature} ${ds-current-datetime}&apos;</row>
        <row>&apos;${ds-nextval}&apos;, &apos;customer${ds-current-record-id}@yahoo.com&apos;, &apos;Customer ${ds-current-record-id}&apos;, &apos;customer&apos;, &apos;123456&apos;, &apos;UTC-4&apos;, &apos;A loyal customer from Sunnyvale, California. ${ds-user-signature} ${ds-current-datetime}&apos;</row>
        <row>&apos;${ds-nextval}&apos;, &apos;customer${ds-current-record-id}@yahoo.com&apos;, &apos;Customer ${ds-current-record-id}&apos;, &apos;customer&apos;, &apos;123456&apos;, &apos;UTC+4&apos;, &apos;A loyal customer from Sunnyvale, California. ${ds-user-signature} ${ds-current-datetime}&apos;</row>
        <row>&apos;${ds-nextval}&apos;, &apos;customer${ds-current-record-id}@yahoo.com&apos;, &apos;Customer ${ds-current-record-id}&apos;, &apos;customer&apos;, &apos;123456&apos;, &apos;UTC+8&apos;, &apos;A loyal customer from Sunnyvale, California. ${ds-user-signature} ${ds-current-datetime}&apos;</row>
        <row>&apos;${ds-nextval}&apos;, &apos;customer${ds-current-record-id}@yahoo.com&apos;, &apos;Customer ${ds-current-record-id}&apos;, &apos;customer&apos;, &apos;123456&apos;, &apos;UTC-7&apos;, &apos;A loyal customer from Sunnyvale, California. ${ds-user-signature} ${ds-current-datetime}&apos;</row>
        <row>&apos;${ds-nextval}&apos;, &apos;customer${ds-current-record-id}@yahoo.com&apos;, &apos;Customer ${ds-current-record-id}&apos;, &apos;customer&apos;, &apos;123456&apos;, &apos;UTC&apos;, &apos;A loyal customer from Sunnyvale, California. ${ds-user-signature} ${ds-current-datetime}&apos;</row>
        <row>&apos;${ds-nextval}&apos;, &apos;customer${ds-current-record-id}@yahoo.com&apos;, &apos;Customer ${ds-current-record-id}&apos;, &apos;customer&apos;, &apos;123456&apos;, &apos;UTC-7&apos;, &apos;A loyal customer from Sunnyvale, California. ${ds-user-signature} ${ds-current-datetime}&apos;</row>
        <row>&apos;${ds-nextval}&apos;, &apos;customer${ds-current-record-id}@yahoo.com&apos;, &apos;Customer ${ds-current-record-id}&apos;, &apos;customer&apos;, &apos;123456&apos;, &apos;UTC&apos;, &apos;A loyal customer from Sunnyvale, California. ${ds-user-signature} ${ds-current-datetime}&apos;</row>
      </input-data>
    </table>
  </tables-spec>
</datashape>
