<?xml version='1.0' encoding='UTF-8'?>
<!DOCTYPE datashape SYSTEM "DataShape.dtd">
<!-- Copyright (C) 2010-2012, Wan Lee, wan5332@gmail.com -->
<!-- Example of using a query in the data shape configuration -->
<datashape>
  <database type="MSSQLSERVER">
    <connection>jdbc:sqlserver://localhost:1433;DatabaseName=actproj</connection>
  </database>
  <population-spec>
    <table-population name="USR">
      <size create-new="false">by-query</size>
    </table-population>
    <table-population name="LOC">
      <size>100</size>
    </table-population>
    <table-population name="USR_LOC">
      <size>by-derivation</size>
      <relationship>M:M</relationship>
      <fkey-providers>
        <fkey-provider name="USR">
          <percent>10</percent>
          <random-select>true</random-select>
        </fkey-provider>
        <fkey-provider name="LOC">
          <percent>10</percent>
          <random-select>true</random-select>
        </fkey-provider>
      </fkey-providers>
    </table-population>
  </population-spec>
  <tables-spec>
    <table name="USR">
	<sql-statement>SELECT USR_ID FROM dbo.USR WHERE USR_TYPE=&apos;user&apos; group by USR_ID order by USR_ID</sql-statement>
      <data-type>empty</data-type>
      <input-data>
        <row>empty</row>
      </input-data>
    </table>
    <table name="LOC">
      <sql-statement>INSERT INTO dbo.LOC (NAME) VALUES (?)</sql-statement>
      <data-type>java.lang.String</data-type>
      <input-data>
        <row>&apos;Main Residence${ds-default-signature}&apos;</row>
      </input-data>
    </table>
    <table name="USR_LOC">
      <sql-statement>INSERT INTO dbo.USR_LOC (LOC_ID, USR_ID) VALUES (?, ?)</sql-statement>
      <data-type>long, long</data-type>
      <input-data>
        <row>&apos;${ds-fkey-provider}=LOC&apos;, &apos;${ds-fkey-provider}=USR&apos;</row>
      </input-data>
    </table>
  </tables-spec>
</datashape>
