<?xml version='1.0' encoding='UTF-8'?>
<!DOCTYPE datashape SYSTEM "DataShape.dtd">
<!-- Copyright (C) 2010-2012, Wan Lee, wan5332@gmail.com -->
<!-- Example of using a query in the data shape configuration -->
<datashape>
  <database type="ORCL">
    <connection>jdbc:oracle:thin:@localhost:1521:xe</connection>
  </database>
  <population-spec>
    <table-population name="USR">
      <size create-new="false">by-query</size>
    </table-population>
    <table-population name="LOC">
      <size>10</size>
    </table-population>
    <table-population name="USR_LOC">
      <size>by-derivation</size>
      <relationship>M:M</relationship>
      <fkey-providers>
        <fkey-provider name="USR">
          <percent>10</percent>
          <random-select>true</random-select>
        </fkey-provider>
        <fkey-provider name="LOC">
          <percent>10</percent>
          <random-select>true</random-select>
        </fkey-provider>
      </fkey-providers>
    </table-population>
  </population-spec>
  <tables-spec>
    <shared-sequence name="ACTPROJ"></shared-sequence>
    <table name="USR">
<!--  <sql-statement>SELECT USR_ID FROM &quot;ACTPROJ&quot;.&quot;USR&quot; where USR_TYPE=&apos;user&apos;</sql-statement>-->      
<sql-statement>SELECT * FROM 
	(SELECT a.USR_ID, rownum R from 
		(SELECT USR_ID FROM &quot;ACTPROJ&quot;.&quot;USR&quot; WHERE USR_TYPE=&apos;user&apos; order by USR_ID) a 
		WHERE rownum &lt; 11) 
		WHERE R &gt; 0</sql-statement>
      <data-type>empty</data-type>
      <input-data>
        <row>empty</row>
      </input-data>
    </table>
    <table name="LOC">
      <sql-statement>INSERT INTO &quot;ACTPROJ&quot;.&quot;LOC&quot; (LOC_ID, NAME) VALUES (?, ?)</sql-statement>
      <data-type>java.math.BigDecimal, java.lang.String</data-type>
      <input-data>
        <row>&apos;${ds-nextval}&apos;, &apos;Main Residence${ds-default-signature}&apos;</row>
      </input-data>
    </table>
    <table name="USR_LOC">
      <sql-statement>INSERT INTO &quot;ACTPROJ&quot;.&quot;USR_LOC&quot; (USR_LOC_ID, LOC_ID, USR_ID) VALUES (?, ?, ?)</sql-statement>
      <data-type>java.math.BigDecimal, java.math.BigDecimal, java.math.BigDecimal</data-type>
      <input-data>
        <row>&apos;${ds-nextval}&apos;, &apos;${ds-fkey-provider}=LOC&apos;, &apos;${ds-fkey-provider}=USR&apos;</row>
      </input-data>
    </table>
  </tables-spec>
</datashape>
